"Actores","Director","Genero","Descripcion","Anho","Titulo"
"Kathryn Hahn, Jackson White, Owen Teague, Jen Richards","N/A","Comedy","A single mom whose son has moved out for college looks to begin a new life on her own.","27 Oct 2019","Mrs. Fletcher"
"Jeff Daniels, Emily Mortimer, John Gallagher Jr., Alison Pill","N/A","Drama","A newsroom undergoes some changes in its workings and morals as a new team is brought in, bringing unexpected results for its existing news anchor.","24 Jun 2012","The Newsroom"
"Jon Hamm, Elisabeth Moss, Vincent Kartheiser, January Jones","N/A","Drama","A drama about one of New York's most prestigious ad agencies at the beginning of the 1960s, focusing on one of the firm's most mysterious but extremely talented ad executives, Donald Draper.","19 Jul 2007","Mad Men"
"Robert Wuhl, Sandra Oh, Jim Turner, Michael Boatman","N/A","Comedy, Sport","Arliss Michaels is not a sports agent, he is a sports super agent. To his team of associates, the athletes he represents and the world around them, he is God. He is like Jerry Maguire, but ...","10 Aug 1996","Arli$$"
"Sarah Jessica Parker, Kim Cattrall, Kristin Davis, Cynthia Nixon","N/A","Comedy, Drama, Romance","Four female New Yorkers gossip about their sex lives (or lack thereof) and find new ways to deal with being a woman in the 1990s.","06 Jun 1998","Sex and the City"
"Dwayne Johnson, John David Washington, Donovan W. Carter, Troy Garity","N/A","Comedy, Drama, Sport","A series centered around a group of football players and their families, friends and handlers.","21 Jun 2015","Ballers"
"Danny McBride, Walton Goggins, Georgia King, Maya G. Love","N/A","Comedy","An over protective father is obsessed with becoming a principal and competes against the popular vice principal. However something happens that makes them work together to save the day.","17 Jul 2016","Vice Principals"
"Kevin McKidd, Ray Stevenson, Polly Walker, Kerry Condon","N/A","Action, Drama, History, Romance, War","A down-to-earth account of the lives of both illustrious and ordinary Romans set in the last days of the Roman Republic.","28 Aug 2005","Rome"
"Ernie Hudson, J.K. Simmons, Lee Tergesen, Dean Winters","N/A","Crime, Drama, Thriller","A series chronicling the daily activities of an unusual prison facility and its criminal inhabitants.","12 Jul 1997","Oz"
"Lena Dunham, Allison Williams, Jemima Kirke, Adam Driver","N/A","Comedy, Drama","A comedy about the experiences of a group of girls in their early 20s.","15 Apr 2012","Girls"
"James Badge Dale, Joseph Mazzello, Jon Seda, Ashton Holmes","N/A","Action, Adventure, Drama, History, War","The Pacific Theatre of World War II, as seen through the eyes of several young Marines.","14 Mar 2010","The Pacific"
"Julia Louis-Dreyfus, Anna Chlumsky, Tony Hale, Reid Scott","N/A","Comedy","Former Senator Selina Meyer finds that being Vice President of the United States is nothing like she hoped and everything that everyone ever warned her about.","22 Apr 2012","Veep"
"Bill Hader, Stephen Root, Sarah Goldberg, Anthony Carrigan","N/A","Action, Comedy, Crime, Drama","A hit man from the Midwest moves to Los Angeles and gets caught up in the city's theatre arts scene.","25 Mar 2018","Barry"
"T.K. Carter, Khandi Alexander, Sean Nelson, Clarke Peters","N/A","Crime, Drama","Chronicles West Baltimore family living in poverty on the front lines of America's drug war.","16 Apr 2000","The Corner"
"Asa Butterfield, Gillian Anderson, Ncuti Gatwa, Emma Mackey","N/A","Comedy, Drama","A teenage boy with a sex therapist mother teams up with a high school classmate to set up an underground sex therapy clinic at school.","11 Jan 2019","Sex Education"
"Richard Madden, Sophie Rundle, Vincent Franklin, Ash Tandon","N/A","Crime, Drama, Thriller","A contemporary thriller featuring the Royalty and Specialist Protection Branch of London's Metropolitan Police Service.","26 Aug 2018","Bodyguard"
"Amy Poehler, Nick Offerman, Aubrey Plaza, Chris Pratt","N/A","Comedy","The absurd antics of an Indiana town's public officials as they pursue sundry projects to make their city a better place.","09 Apr 2009","Parks and Recreation"
"Brandon Routh, Caity Lotz, Amy Louise Pemberton, Dominic Purcell","N/A","Action, Adventure, Drama, Sci-Fi","Time-travelling rogue Rip Hunter has to recruit a rag-tag team of heroes and villains to help prevent an apocalypse that could impact not only Earth, but all of time.","21 Jan 2016","DC's Legends of Tomorrow"
"Stella Maeve, Hale Appleman, Arjun Gupta, Summer Bishil","N/A","Drama, Fantasy, Mystery","After being recruited to a secretive academy, a group of students discover that the magic they read about as children is very real-and more dangerous than they ever imagined.","16 Dec 2015","The Magicians"
"Jessica Barden, Alex Lawther, Steve Oram, Christine Bottomley","N/A","Adventure, Comedy, Crime, Drama, Romance, Thriller","James is 17 and is pretty sure he is a psychopath. Alyssa, also 17, is the cool and moody new girl at school. The pair make a connection and she persuades him to embark on a road trip in search of her real father.","24 Oct 2017","The End of the F***ing World"
"Carey Mulligan, Jeany Spark, Nicola Walker, Nathaniel Martello-White","N/A","Crime, Drama, Mystery, Thriller","London detectives investigating the seemingly random murder of a pizza delivery man uncover a convoluted case of interlocking circumstances amid a cross-section of British society.","09 Mar 2018","Collateral"
"Eliza Coupe, Jay Harrington, Carter MacIntyre, Oscar Nuñez","N/A","Comedy","After losing her boyfriend and her high-powered job as an attorney all on one day, Nina finds that the only job available to her is at the Public Defender's office. She quickly realizes ...","28 Oct 2014","Benched"
"Sigourney Weaver, Carla Gugino, James Wolk, Sebastian Stan","N/A","Drama","A divorced, former First Lady, is currently serving as the Secretary of State. She deals with State Department issues, while trying to keep her family together.","15 Jul 2012","Political Animals"
"Mary McCormack, Frederick Weller, Paul Ben-Victor, Nichole Hiltz","N/A","Crime, Drama, Mystery, Thriller","U.S. Marshal Mary Shannon must hunt down witnesses for federal cases in the witness protection program while also managing a rather dysfunctional family and her own personal life.","01 Jun 2008","In Plain Sight"
"Daniel Sunjata, Aaron Tveit, Vanessa Ferlito, Manny Montana","N/A","Action, Crime, Drama","A rookie FBI agent is sent to a house for undercover agents in Southern California, where he is trained by a former legend FBI agent.","N/A","Graceland"
"Piper Perabo, Christopher Gorham, Kari Matchett, Peter Gallagher","N/A","Action, Crime, Drama, Mystery, Thriller","Fresh out of the farm, Annie Walker must adapt to the challenging life of a CIA operative under the guidance of her handler, Auggie. But soon she realizes her recruit might have to do with her last boyfriend rather than her talent.","13 Jul 2010","Covert Affairs"
"Jeffrey Donovan, Gabrielle Anwar, Bruce Campbell, Sharon Gless","N/A","Action, Crime, Drama, Mystery, Thriller","A spy recently disavowed by the U.S. government uses his special ops training to help others in trouble.","28 Jun 2007","Burn Notice"
"Matt Bomer, Tim DeKay, Willie Garson, Tiffani Thiessen","N/A","Comedy, Crime, Drama, Mystery","A white collar criminal agrees to help the FBI catch other white collar criminals using his expertise as an art and securities thief, counterfeiter, and conman.","23 Oct 2009","White Collar"
"James Roday, Dulé Hill, Timothy Omundson, Maggie Lawson","N/A","Comedy, Crime, Mystery","A novice sleuth is hired by the Police after he cons them into thinking he has psychic powers which help solve crimes. With the assistance of his reluctant best friend, the duo take on a series of complicated cases.","07 Jul 2006","Psych"
"Tony Shalhoub, Jason Gray-Stanford, Ted Levine, Traylor Howard","N/A","Comedy, Crime, Drama, Mystery","Adrian Monk is a brilliant San Francisco detective, whose obsessive compulsive disorder just happens to get in the way.","12 Jul 2002","Monk"
